postId;content;timestamp
P1;Just implemented a new graph algorithm! #GraphDatabases #Algorithms;2024-07-01T10:30:00
P2;Exploring new data visualization techniques #DataScience #Visualization;2024-07-02T11:15:00
P3;React vs Vue: which one are you using? #WebDev #Frontend;2024-07-03T12:20:00
P4;Training my first neural network today! #AI #MachineLearning;2024-07-04T13:45:00
P5;Important security patch released #CyberSecurity #InfoSec;2024-07-05T14:30:00
P6;Automating deployment pipelines #DevOps #Automation;2024-07-06T15:10:00
P7;New mobile app design patterns #MobileDev #Design;2024-07-07T16:20:00
P8;Working on a new game concept #GameDev #IndieGame;2024-07-08T17:30:00
P9;Understanding smart contracts #Blockchain #Web3;2024-07-09T18:15:00
P10;User testing methodologies #UX #UI;2024-07-10T19:05:00
